{
  "schema_version": "1.0",
  "generated_at": "2026-10-27T12:00:00Z",
  "frameworks": [
    { "id": "soc2", "name": "SOC 2", "status": "certified" },
    { "id": "iso27001", "name": "ISO 27001", "status": "certified", "note": "Surveillance audit annually" }
  ],
  "activities": [
    {
      "id": "uar",
      "name": "User Access Review",
      "type": "review",
      "summary": "Quarterly review of production access.",
      "owner": "GRC",
      "grc_contact": "grc@workato.com",
      "cadence": "quarterly",
      "anchor": "2026-02-15",
      "duration_days": 21,
      "drivers": ["SOC 2 CC6.2"],
      "requirements": ["Managers certify access lists"],
      "evidence": ["Signed review export"],
      "frameworks": ["soc2", "iso27001"],
      "team_asks": [{ "team": "Infra", "ask": "Provide privileged account list" }],
      "source_system": "data_table",
      "active": true
    },
    {
      "id": "pen-test",
      "name": "Penetration Test",
      "type": "assessment",
      "summary": "Annual external penetration test.",
      "owner": "Security",
      "grc_contact": "grc@workato.com",
      "cadence": "annual",
      "anchor": null,
      "duration_days": 30,
      "drivers": [],
      "requirements": [],
      "evidence": [],
      "frameworks": ["soc2"],
      "team_asks": [],
      "source_system": "sql",
      "active": true
    }
  ],
  "windows": [
    {
      "window_id": "uar-FY2026-Q2",
      "start": "2026-05-18",
      "end": "2026-06-08",
      "basis": "confirmed",
      "status": "done",
      "jira_key": "GRC-123",
      "notes": "Completed early"
    }
  ]
}
